,"Data for this period of time was third-party verified by APEX using a
limited level of assurance. Following please fnid the criteria used to
measure the carbon, energy, and water information:
For carbon and energy
World Resources Institute (WRI)/World Business Council for Sustainable
Development (WBCSD) Greenhouse Gas Protocol, Corporate Accounting
and Reporting Standard, revised edition, including Scope 2 Guidance
amendment (Scope 1 & 2); WRI/WBCSD Greenhouse Gas Protocol
Corporate Value Chain (Scope 3) Accounting and Reporting Standard
(Scope 3).
For water
CDP Water Security Reporting Guidance
The scope of the verifciation included GHG emissions for Scope 1, Scope
2, Scope 3 business air travel, total energy consumption, total electricity
consumption, total renewable electricity consumption, total offsets
purchased, total water withdrawals, total water consumption, and total
water discharges. For FY20, the rest of Scope 3 category emissions
identified as relevant were also included. Latest data adjustments
highlighted in this report made to historic data were outside of the scope
of these previous years’ review.
Any revisions made to FY20 reported values on this report were outside
of the limited assurance review done by APEX.","Microsoft obtains limited third-
party assurance for the most
recent year (FY23) prior to the
issuance of the Environmental
Data Fact Sheet. The limited
assurance reviews performed by
Deloitte & Touche LLP in FY21
and FY22 do not contemplate
the revisions to the prior year
metrics and therefore Deloitte
& Touche LLP provides no
assurance related to the revisions
consistent with our policies
disclosed in Section 1.8"
